<?xml version="1.0" encoding="UTF-8"?>
<potvrda_o_vakcinaciji
        xmlns="http://www.ftn.uns.ac.rs/xml_i_veb_servisi/potvrda_o_vakcinaciji"
        xmlns:xsi="http://www.w3.org/2001/XMLSchema-instance"
        xmlns:jxb="http://java.sun.com/xml/ns/jaxb"
        xmlns:pred="http://www.ftn.uns.ac.rs/xml_i_veb_servisi/rdf/potvrda_o_vakcinaciji/predicate/"
        xsi:schemaLocation="http://www.ftn.uns.ac.rs/potvrda_o_vakcinaciji ../schema/potvrda_o_vakcinaciji.xsd"
       about="http://www.ftn.uns.ac.rs/xml_i_veb_servisi/potvrda_o_vakcinaciji/1234567891234_2022-02-12"
       sifra_potvrde_vakcine="1234567891234_2022-02-12">
    <licni_podaci>
        <ime>Pera</ime>
        <prezime>Peric</prezime>
        <datum_rodjenja>1987-02-23</datum_rodjenja>
        <pol>Muski</pol>
        <jmbg>1234567890123</jmbg>
    </licni_podaci>
    <vakcinacija>
        <doze>
            <doza>
                <broj>1</broj>
                <datum_davanja>2021-08-05</datum_davanja>
                <broj_serije>23</broj_serije>
                <naziv_vakcine>Pfeizer</naziv_vakcine>
            </doza>
        </doze>
        <zdravstvena_ustanova>Bolnica</zdravstvena_ustanova>
    </vakcinacija>
    <zdravstvena_ustanova>Bolnica</zdravstvena_ustanova>
    <datum_izdavanja>2021-09-18</datum_izdavanja>
</potvrda_o_vakcinaciji>
